{
  "chapter_title": "GitHub Pages Personal Website",
  "title": "Publishing With GitHub Pages",
  "description": "CAT 100 textbook section connecting publishing with github pages to GitHub Pages file tree with accessibility, privacy, and publishing checks, reader notes, support moments, and revision evidence.",
  "learning_objectives": [
    "Analyze how the GitHub Pages file tree with accessibility, privacy, and publishing checks shows a defensible decision in CAT 100.",
    "Distinguish artifact polish from evidence-based revision.",
    "Document a bounded AI/software support move with accepted and rejected suggestions.",
    "Use feedback, support requests, and revision notes to improve the artifact before sharing it."
  ],
  "concept_ids": [
    "cat100_supplement_github_pages_personal_website",
    "cat100_supplement_publishing_with_github_pages",
    "cat100_supplement_evidence_based_revision",
    "cat100_supplement_ai_supported_learning"
  ],
  "estimated_time_minutes": 14,
  "order": 4,
  "top_tier_hardened": true
}
