{
  "chapter_title": "Instructor Toolkit for CAT 531",
  "title": "Low-Tech Fallbacks",
  "description": "CAT 531 textbook section connecting low-tech fallbacks to Design Tension Studio map naming a classroom value conflict and negotiated decision, social annotation signals, and adaptive learner-model evidence.",
  "learning_objectives": [
    "Analyze a Design Tension Studio map naming a classroom value conflict and negotiated decision as evidence of learner judgment in CAT 531.",
    "Distinguish artifact polish from evidence-based revision.",
    "Document a bounded AI/software support move with accepted and rejected suggestions.",
    "Identify annotation, artifact, support, and calibration signals for intelligent textbook research."
  ],
  "concept_ids": [
    "cat531_supplement_instructor_toolkit_for_cat_531",
    "cat531_supplement_low_tech_fallbacks",
    "cat531_supplement_evidence_based_revision",
    "cat531_supplement_ai_supported_learning"
  ],
  "estimated_time_minutes": 14,
  "order": 6,
  "top_tier_hardened": true
}
