{
  "chapter_title": "Design Draft and Theory-to-Prototype Alignment",
  "title": "Module 4 Design Draft Clinic",
  "description": "AIL 606 textbook section connecting module 4 design draft clinic to storyboard frame sequence with narration, signaling, and reader-action notes, reader notes, support moments, and revision evidence.",
  "learning_objectives": [
    "Analyze how the storyboard frame sequence with narration, signaling, and reader-action notes shows a defensible decision in AIL 606.",
    "Distinguish artifact polish from evidence-based revision.",
    "Document a bounded AI/software support move with accepted and rejected suggestions.",
    "Use annotations, support requests, and revision notes to decide what help or design change should come next."
  ],
  "concept_ids": [
    "ail606_supplement_design_draft_and_theory_to_prototype_alignment",
    "ail606_supplement_module_4_design_draft_clinic",
    "ail606_supplement_evidence_based_revision",
    "ail606_supplement_ai_supported_learning"
  ],
  "estimated_time_minutes": 14,
  "order": 8,
  "top_tier_hardened": true
}
