{
  "chapter_title": "Final Project and Professional Vision",
  "title": "Synthesis Across Modules",
  "description": "CAT 531 textbook section connecting synthesis across modules to field-placement transfer note connecting tool choice to classroom constraints, reader notes, support moments, and revision evidence.",
  "learning_objectives": [
    "Analyze how the field-placement transfer note connecting tool choice to classroom constraints shows a defensible decision in CAT 531.",
    "Distinguish artifact polish from evidence-based revision.",
    "Document a bounded AI/software support move with accepted and rejected suggestions.",
    "Use annotations, support requests, and revision notes to make a classroom technology decision more defensible."
  ],
  "concept_ids": [
    "cat531_supplement_final_project_and_professional_vision",
    "cat531_supplement_synthesis_across_modules",
    "cat531_supplement_evidence_based_revision",
    "cat531_supplement_ai_supported_learning"
  ],
  "estimated_time_minutes": 14,
  "order": 1,
  "top_tier_hardened": true
}
