{
  "chapter_title": "Productivity and Workflow Automation",
  "title": "Collaboration Norms",
  "description": "CAT 100 textbook section connecting collaboration norms to AI critique log showing accepted, modified, and rejected suggestions, reader notes, support moments, and revision evidence.",
  "learning_objectives": [
    "Analyze how the AI critique log showing accepted, modified, and rejected suggestions shows a defensible decision in CAT 100.",
    "Distinguish artifact polish from evidence-based revision.",
    "Document a bounded AI/software support move with accepted and rejected suggestions.",
    "Use feedback, support requests, and revision notes to improve the artifact before sharing it."
  ],
  "concept_ids": [
    "cat100_supplement_productivity_and_workflow_automation",
    "cat100_supplement_collaboration_norms",
    "cat100_supplement_evidence_based_revision",
    "cat100_supplement_ai_supported_learning"
  ],
  "estimated_time_minutes": 14,
  "order": 6,
  "top_tier_hardened": true
}
