{
  "chapter_title": "Foundations of Interactive Multimedia Learning",
  "title": "Cognitive Load Diagnosis",
  "description": "AIL 606 textbook section connecting cognitive load diagnosis to cognitive load diagnosis table with intrinsic/extraneous/germane load evidence, social annotation signals, and adaptive learner-model evidence.",
  "learning_objectives": [
    "Analyze a cognitive load diagnosis table with intrinsic/extraneous/germane load evidence as evidence of learner judgment in AIL 606.",
    "Distinguish artifact polish from evidence-based revision.",
    "Document a bounded AI/software support move with accepted and rejected suggestions.",
    "Identify annotation, artifact, support, and calibration signals for intelligent textbook research."
  ],
  "concept_ids": [
    "ail606_supplement_foundations_of_interactive_multimedia_learning",
    "ail606_supplement_cognitive_load_diagnosis",
    "ail606_supplement_evidence_based_revision",
    "ail606_supplement_ai_supported_learning"
  ],
  "estimated_time_minutes": 14,
  "order": 3,
  "top_tier_hardened": true
}
