{
  "chapter_title": "Instructor Toolkit for CAT 531",
  "title": "TeachGen@i Troubleshooting",
  "description": "Artifact-specific exemplar for CAT 531 connecting teachgen@i troubleshooting to Ethobot transcript annotation, social annotation signals, and adaptive learner-model evidence.",
  "learning_objectives": [
    "Analyze a Ethobot transcript annotation as evidence of learner judgment in CAT 531.",
    "Distinguish artifact polish from evidence-based revision.",
    "Document a bounded AI/software support move with accepted and rejected suggestions.",
    "Identify annotation, artifact, support, and calibration signals for intelligent textbook research."
  ],
  "concept_ids": [
    "cat531_supplement_instructor_toolkit_for_cat_531",
    "cat531_supplement_teachgen_i_troubleshooting",
    "cat531_supplement_evidence_based_revision",
    "cat531_supplement_ai_supported_learning"
  ],
  "estimated_time_minutes": 14,
  "order": 2,
  "top_tier_hardened": true
}
