{
  "chapter_title": "Teaching in Tech-Rich Classrooms With TeachGen@i",
  "title": "Tech-Rich Classroom Routines",
  "description": "CAT 531 textbook section connecting tech-rich classroom routines to Design Tension Studio map naming a classroom value conflict and negotiated decision, reader notes, support moments, and revision evidence.",
  "learning_objectives": [
    "Analyze how the Design Tension Studio map naming a classroom value conflict and negotiated decision shows a defensible decision in CAT 531.",
    "Distinguish artifact polish from evidence-based revision.",
    "Document a bounded AI/software support move with accepted and rejected suggestions.",
    "Use annotations, support requests, and revision notes to make a classroom technology decision more defensible."
  ],
  "concept_ids": [
    "cat531_supplement_teaching_in_tech_rich_classrooms_with_teachgen_i",
    "cat531_supplement_tech_rich_classroom_routines",
    "cat531_supplement_evidence_based_revision",
    "cat531_supplement_ai_supported_learning"
  ],
  "estimated_time_minutes": 14,
  "order": 1,
  "top_tier_hardened": true
}
