{
  "chapter_title": "Final Project and Professional Vision",
  "title": "Presentation of Professional Vision",
  "description": "Artifact-specific exemplar for CAT 531 connecting presentation of professional vision to field-placement transfer note, social annotation signals, and adaptive learner-model evidence.",
  "learning_objectives": [
    "Analyze a field-placement transfer note as evidence of learner judgment in CAT 531.",
    "Distinguish artifact polish from evidence-based revision.",
    "Document a bounded AI/software support move with accepted and rejected suggestions.",
    "Identify annotation, artifact, support, and calibration signals for intelligent textbook research."
  ],
  "concept_ids": [
    "cat531_supplement_final_project_and_professional_vision",
    "cat531_supplement_presentation_of_professional_vision",
    "cat531_supplement_evidence_based_revision",
    "cat531_supplement_ai_supported_learning"
  ],
  "estimated_time_minutes": 14,
  "order": 7,
  "top_tier_hardened": true
}
