{
  "chapter_title": "AI in Education",
  "title": "School Policy Interpretation",
  "description": "CAT 531 textbook section connecting school policy interpretation to school AI policy memo with privacy, equity, consent, and learning-purpose checks, social annotation signals, and adaptive learner-model evidence.",
  "learning_objectives": [
    "Analyze a school AI policy memo with privacy, equity, consent, and learning-purpose checks as evidence of learner judgment in CAT 531.",
    "Distinguish artifact polish from evidence-based revision.",
    "Document a bounded AI/software support move with accepted and rejected suggestions.",
    "Identify annotation, artifact, support, and calibration signals for intelligent textbook research."
  ],
  "concept_ids": [
    "cat531_supplement_ai_in_education",
    "cat531_supplement_school_policy_interpretation",
    "cat531_supplement_evidence_based_revision",
    "cat531_supplement_ai_supported_learning"
  ],
  "estimated_time_minutes": 14,
  "order": 6,
  "top_tier_hardened": true
}
