{
  "chapter_title": "Instructor Implementation Toolkit",
  "title": "AI Policy Language for Students",
  "description": "AIL 606 textbook section connecting ai policy language for students to AI-USE disclosure excerpt tied to one bounded design-support decision, reader notes, support moments, and revision evidence.",
  "learning_objectives": [
    "Analyze how the AI-USE disclosure excerpt tied to one bounded design-support decision shows a defensible decision in AIL 606.",
    "Distinguish artifact polish from evidence-based revision.",
    "Document a bounded AI/software support move with accepted and rejected suggestions.",
    "Use annotations, support requests, and revision notes to decide what help or design change should come next."
  ],
  "concept_ids": [
    "ail606_supplement_instructor_implementation_toolkit",
    "ail606_supplement_ai_policy_language_for_students",
    "ail606_supplement_evidence_based_revision",
    "ail606_supplement_ai_supported_learning"
  ],
  "estimated_time_minutes": 14,
  "order": 4,
  "top_tier_hardened": true
}
