{
  "chapter_title": "Resume, Branding, and AI Brainstorming",
  "title": "Revision Logs",
  "description": "CAT 100 textbook section connecting revision logs to resume before-after revision with truthful evidence, role fit, and AI-use note, reader notes, support moments, and revision evidence.",
  "learning_objectives": [
    "Analyze how the resume before-after revision with truthful evidence, role fit, and AI-use note shows a defensible decision in CAT 100.",
    "Distinguish artifact polish from evidence-based revision.",
    "Document a bounded AI/software support move with accepted and rejected suggestions.",
    "Use feedback, support requests, and revision notes to improve the artifact before sharing it."
  ],
  "concept_ids": [
    "cat100_supplement_resume_branding_and_ai_brainstorming",
    "cat100_supplement_revision_logs",
    "cat100_supplement_evidence_based_revision",
    "cat100_supplement_ai_supported_learning"
  ],
  "estimated_time_minutes": 14,
  "order": 6,
  "top_tier_hardened": true
}
