{
    "title": "Module 7: Universal Design for Learning (UDL)",
    "description": "Designing accessible learning experiences that accommodate neurodiversity and physical disabilities by providing multiple means of representation, action, and engagement.",
    "chapter_title": "Accessibility and Inclusive Learning Design",
    "learning_objectives": [
        "Explain the three UDL pillars and how they support learner variability.",
        "Audit an instructional experience for accessibility, flexibility, and cognitive inclusion.",
        "Choose representation, expression, and engagement supports that expand access without lowering rigor."
    ],
    "concept_ids": [
        "universal_design_for_learning",
        "multiple_means_of_representation",
        "multiple_means_of_action_and_expression",
        "multiple_means_of_engagement",
        "inclusive_design"
    ],
    "estimated_time_minutes": 12,
    "order": 7
}
