{
  "chapter_title": "Instructor Toolkit for CAT 531",
  "title": "Discussion Prompts by Module",
  "description": "CAT 531 textbook section connecting discussion prompts by module to TeachGen@i prompt transcript with teacher edits and rejected suggestions, reader notes, support moments, and revision evidence.",
  "learning_objectives": [
    "Analyze how the TeachGen@i prompt transcript with teacher edits and rejected suggestions shows a defensible decision in CAT 531.",
    "Distinguish artifact polish from evidence-based revision.",
    "Document a bounded AI/software support move with accepted and rejected suggestions.",
    "Use annotations, support requests, and revision notes to make a classroom technology decision more defensible."
  ],
  "concept_ids": [
    "cat531_supplement_instructor_toolkit_for_cat_531",
    "cat531_supplement_discussion_prompts_by_module",
    "cat531_supplement_evidence_based_revision",
    "cat531_supplement_ai_supported_learning"
  ],
  "estimated_time_minutes": 14,
  "order": 5,
  "top_tier_hardened": true
}
