{
  "chapter_title": "AI Ethics and Ethobot 3.2",
  "title": "Stakeholders in School AI",
  "description": "CAT 531 textbook section connecting stakeholders in school ai to Design Tension Studio map naming a classroom value conflict and negotiated decision, reader notes, support moments, and revision evidence.",
  "learning_objectives": [
    "Analyze how the Design Tension Studio map naming a classroom value conflict and negotiated decision shows a defensible decision in CAT 531.",
    "Distinguish artifact polish from evidence-based revision.",
    "Document a bounded AI/software support move with accepted and rejected suggestions.",
    "Use annotations, support requests, and revision notes to make a classroom technology decision more defensible."
  ],
  "concept_ids": [
    "cat531_supplement_ai_ethics_and_ethobot_3_2",
    "cat531_supplement_stakeholders_in_school_ai",
    "cat531_supplement_evidence_based_revision",
    "cat531_supplement_ai_supported_learning"
  ],
  "estimated_time_minutes": 14,
  "order": 3,
  "top_tier_hardened": true
}
