{
  "chapter_title": "GitHub Pages Personal Website",
  "title": "Module 6 Website Studio",
  "description": "CAT 100 textbook section connecting module 6 website studio to resume before-after revision with truthful evidence, role fit, and AI-use note, reader notes, support moments, and revision evidence.",
  "learning_objectives": [
    "Analyze how the resume before-after revision with truthful evidence, role fit, and AI-use note shows a defensible decision in CAT 100.",
    "Distinguish artifact polish from evidence-based revision.",
    "Document a bounded AI/software support move with accepted and rejected suggestions.",
    "Use feedback, support requests, and revision notes to improve the artifact before sharing it."
  ],
  "concept_ids": [
    "cat100_supplement_github_pages_personal_website",
    "cat100_supplement_module_6_website_studio",
    "cat100_supplement_evidence_based_revision",
    "cat100_supplement_ai_supported_learning"
  ],
  "estimated_time_minutes": 14,
  "order": 8,
  "top_tier_hardened": true
}
