{
  "chapter_title": "Educational Technology Evaluation",
  "title": "Adoption Recommendation",
  "description": "Artifact-specific exemplar for CAT 531 connecting adoption recommendation to school AI policy memo, social annotation signals, and adaptive learner-model evidence.",
  "learning_objectives": [
    "Analyze a school AI policy memo as evidence of learner judgment in CAT 531.",
    "Distinguish artifact polish from evidence-based revision.",
    "Document a bounded AI/software support move with accepted and rejected suggestions.",
    "Identify annotation, artifact, support, and calibration signals for intelligent textbook research."
  ],
  "concept_ids": [
    "cat531_supplement_educational_technology_evaluation",
    "cat531_supplement_adoption_recommendation",
    "cat531_supplement_evidence_based_revision",
    "cat531_supplement_ai_supported_learning"
  ],
  "estimated_time_minutes": 14,
  "order": 6,
  "top_tier_hardened": true
}
