{
    "chapter_title": "Introduction to Instructional Design",
    "title": "Module 2: Cognitive Load & Schema",
    "description": "Examine how working memory limits, schema development, and instructional presentation choices interact to support or overload learners.",
    "learning_objectives": [
        "Explain the three types of cognitive load: intrinsic, extraneous, and germane.",
        "Understand schema theory and its role in information processing.",
        "Identify design decisions that reduce overload and support schema formation."
    ],
    "concept_ids": [
        "cognitive_load",
        "schema_theory",
        "intrinsic_load",
        "extraneous_load",
        "germane_load"
    ],
    "estimated_time_minutes": 11
}
