{
  "chapter_title": "Learning Experience Design and Software Technology",
  "title": "AI Tutor Boundaries",
  "description": "Artifact-specific exemplar for AIL 606 connecting ai tutor boundaries to capstone defense evidence board, social annotation signals, and adaptive learner-model evidence.",
  "learning_objectives": [
    "Analyze a capstone defense evidence board as evidence of learner judgment in AIL 606.",
    "Distinguish artifact polish from evidence-based revision.",
    "Document a bounded AI/software support move with accepted and rejected suggestions.",
    "Identify annotation, artifact, support, and calibration signals for intelligent textbook research."
  ],
  "concept_ids": [
    "ail606_supplement_learning_experience_design_and_software_technology",
    "ail606_supplement_ai_tutor_boundaries",
    "ail606_supplement_evidence_based_revision",
    "ail606_supplement_ai_supported_learning"
  ],
  "estimated_time_minutes": 14,
  "order": 5,
  "top_tier_hardened": true
}
