{
  "chapter_title": "Research Translation for Learning Design",
  "title": "Small-N Testing and Design Claims",
  "description": "AIL 606 textbook section connecting small-n testing and design claims to moderated usability test script with observation-to-revision trace, reader notes, support moments, and revision evidence.",
  "learning_objectives": [
    "Analyze how the moderated usability test script with observation-to-revision trace shows a defensible decision in AIL 606.",
    "Distinguish artifact polish from evidence-based revision.",
    "Document a bounded AI/software support move with accepted and rejected suggestions.",
    "Use annotations, support requests, and revision notes to decide what help or design change should come next."
  ],
  "concept_ids": [
    "ail606_supplement_research_translation_for_learning_design",
    "ail606_supplement_small_n_testing_and_design_claims",
    "ail606_supplement_evidence_based_revision",
    "ail606_supplement_ai_supported_learning"
  ],
  "estimated_time_minutes": 14,
  "order": 4,
  "top_tier_hardened": true
}
