{
  "chapter_title": "AI-Enhanced Presentation Development",
  "title": "Citation and Attribution",
  "description": "CAT 100 textbook section connecting citation and attribution to GitHub Pages file tree with accessibility, privacy, and publishing checks, reader notes, support moments, and revision evidence.",
  "learning_objectives": [
    "Analyze how the GitHub Pages file tree with accessibility, privacy, and publishing checks shows a defensible decision in CAT 100.",
    "Distinguish artifact polish from evidence-based revision.",
    "Document a bounded AI/software support move with accepted and rejected suggestions.",
    "Use feedback, support requests, and revision notes to improve the artifact before sharing it."
  ],
  "concept_ids": [
    "cat100_supplement_ai_enhanced_presentation_development",
    "cat100_supplement_citation_and_attribution",
    "cat100_supplement_evidence_based_revision",
    "cat100_supplement_ai_supported_learning"
  ],
  "estimated_time_minutes": 14,
  "order": 6,
  "top_tier_hardened": true
}
