{
  "chapter_title": "Field-Based Transfer and Coaching",
  "title": "Mentor Teacher Conversation Guides",
  "description": "Artifact-specific exemplar for CAT 531 connecting mentor teacher conversation guides to TeachGen@i prompt transcript, social annotation signals, and adaptive learner-model evidence.",
  "learning_objectives": [
    "Analyze a TeachGen@i prompt transcript as evidence of learner judgment in CAT 531.",
    "Distinguish artifact polish from evidence-based revision.",
    "Document a bounded AI/software support move with accepted and rejected suggestions.",
    "Identify annotation, artifact, support, and calibration signals for intelligent textbook research."
  ],
  "concept_ids": [
    "cat531_supplement_field_based_transfer_and_coaching",
    "cat531_supplement_mentor_teacher_conversation_guides",
    "cat531_supplement_evidence_based_revision",
    "cat531_supplement_ai_supported_learning"
  ],
  "estimated_time_minutes": 14,
  "order": 2,
  "top_tier_hardened": true
}
